{
  "metadata": {
    "guideCode": "D-22-2012",
    "shortCode": "D22",
    "domain": "C",
    "extractedAt": "2026-04-23T19:08:25Z",
    "extractedBy": "claude-opus-pilot",
    "batchId": "pipeb-batch-C-014"
  },
  "checklistItems": [
    {
      "identifier": "CI-D22-001",
      "text": "가스 등 혼합물의 폭발하한계는 아래 식을 이용하여 산정한다\nLEL_mix = 1 / (∑(i=1 to n) y_i / LEL_i)",
      "guideContext": "가연성가스 및 증기혼합물의 폭발한계 산정",
      "additionalDetail": "LEL_mix: 가스 등 혼합물의 폭발하한계(Vol %), LEL_i: 가스 등의 성분 중 i 성분의 폭발하한계(Vol %), y_i: 가스 등의 성분 중 i 성분의 mol 분율, n: 가스 등의 성분의 수",
      "workProcessPhase": "폭발하한계 산정",
      "bindingForce": "RECOMMENDED",
      "requirementType": "PROCEDURAL",
      "sourceSection": "4.1",
      "basedOn": null
    },
    {
      "identifier": "CI-D22-002",
      "text": "가스 등의 폭발하한계는 온도에 따라 증가하므로 식(2) 또는 식(3)을 이용하여 산정한다.\nLEL_T = LEL_25 - (0.8LEL_25 × 10^(-3))(T - 25)\nLEL_T = LEL_25 (1 - 0.75 × (T - 25) / ΔH_c)",
      "guideContext": "가연성가스 및 증기혼합물의 폭발한계 산정",
      "additionalDetail": "LEL_T: 특정 온도(T)에서의 폭발하한계, LEL_25: 25℃에서 폭발하한계, ΔH_c: 가스 등의 연소열 [kcal/mol], T: 온도 [℃]",
      "workProcessPhase": "폭발하한계 온도 보정",
      "bindingForce": "RECOMMENDED",
      "requirementType": "PROCEDURAL",
      "sourceSection": "4.2",
      "basedOn": null
    },
    {
      "identifier": "CI-D22-003",
      "text": "가스 등의 폭발하한계는 압력에 따라 거의 영향을 받지 않는다. 다만, LNG의 경우는 다음 식을 이용하여 산정한다.\nLEL_p = 4.5 - 0.71logP",
      "guideContext": "가연성가스 및 증기혼합물의 폭발한계 산정",
      "additionalDetail": "LEL_p: 25℃ 및 P 압력에서의 폭발하한계, P: 공정의 절대압력 [atm]",
      "workProcessPhase": "폭발하한계 압력 보정",
      "bindingForce": "RECOMMENDED",
      "requirementType": "PROCEDURAL",
      "sourceSection": "4.3",
      "basedOn": null
    },
    {
      "identifier": "CI-D22-004",
      "text": "가스 등의 폭발상한계는 아래의 식을 이용하여 산정한다.\nUEL_mix = 1 / (∑(i=1 to n) y_i / UEL_i)",
      "guideContext": "가연성가스 및 증기혼합물의 폭발한계 산정",
      "additionalDetail": "UEL_mix: 가스 등 혼합물의 폭발상한계(Vol %), UEL_i: 가스 등의 성분 중 i 성분의 폭발상한계(Vol %), y_i: 가스 등의 성분 중 i 성분의 mol 분율, n: 가스 등의 성분의 수",
      "workProcessPhase": "폭발상한계 산정",
      "bindingForce": "RECOMMENDED",
      "requirementType": "PROCEDURAL",
      "sourceSection": "5.1",
      "basedOn": null
    },
    {
      "identifier": "CI-D22-005",
      "text": "가스 등의 폭발상한계는 온도에 따라 증가하므로 식(6) 또는 식(7)을 이용하여 산정한다.\nUEL_T = UEL_25 + (0.8UEL_25 × 10^(-3))(T - 25)\nUEL_T = UEL_25 (1 + 0.75 × (T - 25) / ΔH_c)",
      "guideContext": "가연성가스 및 증기혼합물의 폭발한계 산정",
      "additionalDetail": "UEL_T: 특정 온도(T)에서의 폭발상한계, UEL_25: 25℃에서 폭발상한계, ΔH_c: 가스 등의 연소열 [kcal/mol], T: 온도 [℃]",
      "workProcessPhase": "폭발상한계 온도 보정",
      "bindingForce": "RECOMMENDED",
      "requirementType": "PROCEDURAL",
      "sourceSection": "5.2",
      "basedOn": null
    },
    {
      "identifier": "CI-D22-006",
      "text": "가스 등의 폭발상한계는 압력의 증가에 따라 증가하므로 다음 식을 이용하여 산정한다.\nUEL_p = UEL_25 + 20.6(logP + 1)",
      "guideContext": "가연성가스 및 증기혼합물의 폭발한계 산정",
      "additionalDetail": "UEL_P: 25℃ 및 어느 압력(P)에서의 폭발상한계, UEL_25: 25℃에서 폭발상한계, P: 공정의 절대압력 [MPa]",
      "workProcessPhase": "폭발상한계 압력 보정",
      "bindingForce": "RECOMMENDED",
      "requirementType": "PROCEDURAL",
      "sourceSection": "5.3",
      "basedOn": null
    },
    {
      "identifier": "CI-D22-007",
      "text": "LNG의 경우는 다음식을 이용하여 산정한다.\nUEL_p = 14.2 + 20.4logP",
      "guideContext": "가연성가스 및 증기혼합물의 폭발한계 산정",
      "additionalDetail": "P: 공정의 절대압력[atm]. LNG 폭발상한계의 압력 보정 전용 식",
      "workProcessPhase": "폭발상한계 압력 보정",
      "bindingForce": "RECOMMENDED",
      "requirementType": "PROCEDURAL",
      "sourceSection": "5.3",
      "basedOn": null
    },
    {
      "identifier": "CI-D22-008",
      "text": "폭발하한계는 압력의 의존성이 적기 때문에 온도의 영향만 고려하여 산정한다.",
      "guideContext": "가연성가스 및 증기혼합물의 폭발한계 산정 (법령 근거 미확인)",
      "additionalDetail": "온도와 압력이 결합된 경우의 폭발하한계 산정 원칙",
      "workProcessPhase": "온도·압력 결합 폭발한계 산정",
      "bindingForce": "RECOMMENDED",
      "requirementType": "PROCEDURAL",
      "sourceSection": "6",
      "basedOn": null
    },
    {
      "identifier": "CI-D22-009",
      "text": "폭발상한계는 온도와 압력의 의존성이 크므로 각각의 온도, 압력하에서 폭발상한계를 산정하여 큰 값을 폭발상한계로 한다.",
      "guideContext": "가연성가스 및 증기혼합물의 폭발한계 산정 (법령 근거 미확인)",
      "additionalDetail": "온도와 압력이 결합된 경우의 폭발상한계 산정 원칙. 온도 보정값과 압력 보정값 중 큰 값을 채택",
      "workProcessPhase": "온도·압력 결합 폭발한계 산정",
      "bindingForce": "RECOMMENDED",
      "requirementType": "PROCEDURAL",
      "sourceSection": "6",
      "basedOn": null
    }
  ],
  "domainTerms": [
    {
      "identifier": "DT-D22-001",
      "term": "폭발한계",
      "definition": "가스 등의 농도가 일정한 범위내에 있을때 폭발현상이 일어나는 것으로, 그 농도가 지나치게 낮거나 지나치게 높아도 폭발은 일어나지 않는 범위를 폭발한계라 말한다.",
      "sourceSection": "3",
      "relatedSR": null
    },
    {
      "identifier": "DT-D22-002",
      "term": "폭발하한계",
      "definition": "가스 등이 공기중에서 점화원에 의하여 착화되어 화염이 전파되는 가스 등의 최소농도를 말한다.",
      "sourceSection": "3",
      "relatedSR": null
    },
    {
      "identifier": "DT-D22-003",
      "term": "폭발상한계",
      "definition": "가스 등이 공기중에서 점화원에 의하여 착화되어 화염이 전파되는 가스 등의 최대농도를 말한다.",
      "sourceSection": "3",
      "relatedSR": null
    }
  ],
  "workProcesses": [
    {
      "identifier": "WP-D22-01",
      "processOrder": 1,
      "processName": "가스 등 혼합물의 폭발하한계 산정",
      "safetyMeasures": "르샤틀리에 식(LEL_mix = 1 / ∑(y_i / LEL_i))을 이용하여 혼합가스의 폭발하한계를 산정한다. 각 성분의 mol 분율과 개별 폭발하한계 데이터를 확보하여야 한다.",
      "requiredPPE": [],
      "sourceSection": "4.1",
      "relatedSR": null
    },
    {
      "identifier": "WP-D22-02",
      "processOrder": 2,
      "processName": "폭발하한계의 온도·압력 보정",
      "safetyMeasures": "온도 보정은 식(2) 또는 식(3)을 적용한다. 압력은 폭발하한계에 거의 영향을 주지 않으나, LNG의 경우 식(4)를 적용한다. 25℃ 기준값, 연소열, 공정 온도·압력 데이터를 사전에 확보한다.",
      "requiredPPE": [],
      "sourceSection": "4.2",
      "relatedSR": null
    },
    {
      "identifier": "WP-D22-03",
      "processOrder": 3,
      "processName": "가스 등 혼합물의 폭발상한계 산정",
      "safetyMeasures": "르샤틀리에 식(UEL_mix = 1 / ∑(y_i / UEL_i))을 이용하여 혼합가스의 폭발상한계를 산정한다. 각 성분의 mol 분율과 개별 폭발상한계 데이터를 확보하여야 한다.",
      "requiredPPE": [],
      "sourceSection": "5.1",
      "relatedSR": null
    },
    {
      "identifier": "WP-D22-04",
      "processOrder": 4,
      "processName": "폭발상한계의 온도·압력 보정",
      "safetyMeasures": "온도 보정은 식(6) 또는 식(7), 압력 보정은 식(8)을 적용한다. LNG의 경우 압력 보정은 식(9)를 적용한다. 온도와 압력이 결합된 경우 각각 산정하여 큰 값을 폭발상한계로 채택한다.",
      "requiredPPE": [],
      "sourceSection": "5.2",
      "relatedSR": null
    }
  ],
  "equipmentSpecs": [],
  "documentRequirements": [
    {
      "identifier": "DR-D22-001",
      "documentType": "WORK_PLAN",
      "title": "공정안전보고서 내 폭발한계 산정 자료",
      "requiredSections": [
        "가연성가스 성분 분석 데이터",
        "폭발하한계 산정 결과",
        "폭발상한계 산정 결과",
        "온도·압력 보정 결과"
      ],
      "sourceSection": "1",
      "relatedSR": null
    }
  ]
}